{
  "format": "shine-public-bible-content-channel",
  "schemaVersion": 1,
  "payload": {
    "channelId": "shine-public-bible-stable",
    "contentVersion": 27,
    "issuedAt": "2026-09-13T07:15:00.000Z",
    "expiresAt": "2028-09-13T07:15:00.000Z",
    "distributionScope": "public",
    "updatePolicy": {
      "versionAuthority": "contentVersion",
      "issuedAtRole": "audit-only",
      "equalVersionEqualHash": "no-op",
      "equalVersionDifferentHash": "reject-conflict",
      "lowerVersion": "reject-downgrade",
      "higherVersion": "accept-after-verification"
    },
    "artifacts": [
      {
        "kind": "bible-corpus",
        "id": "RV1909",
        "schemaVersion": 1,
        "contentVersion": 1,
        "sourceVersionId": "RV1909",
        "sourceCorpusSha256": "af7a0acc03b228719b549539dcd0dcaca3c40af51a4b3d6c96f51ec8510ec739",
        "contentSha256": "3b5d3e79834d89301f4dbb4190c018fb77b2b6846fb97f81c0584a197aa700d3",
        "sizeBytes": 1338497,
        "mimeType": "application/json+gzip",
        "artifactPath": "rv1909.v1.package.json.gz",
        "expectedBookCount": 66,
        "includedBookCount": 66,
        "rights": {
          "license": "Public Domain",
          "copyright": "Public Domain",
          "rightsUrl": "https://ebible.org/spaRV1909/copyright.htm"
        }
      },
      {
        "kind": "reading-filter",
        "id": "RV1909-LECTURA-2026",
        "schemaVersion": 1,
        "contentVersion": 27,
        "sourceVersionId": "RV1909",
        "sourceCorpusSha256": "af7a0acc03b228719b549539dcd0dcaca3c40af51a4b3d6c96f51ec8510ec739",
        "contentSha256": "0af535e37cb05b056ea57d633e9b49cb86ae2f120186c31a73391df36e0f02c4",
        "sizeBytes": 1058528,
        "mimeType": "application/json+gzip",
        "artifactPath": "reading_2026.rv1909.v27.package.json.gz",
        "expectedBookCount": 66,
        "includedBookCount": 66,
        "coverage": {
          "changedVerseCount": 9128,
          "editCount": 12026
        },
        "editorialPolicy": {
          "id": "unified-minimal-comprehension-policy",
          "version": 26,
          "description": "Only exact, full-context comprehension improvements are applied. Understandable wording and doctrinal or textual ambiguities remain unchanged."
        }
      }
    ]
  },
  "contentSha256": "ce36326beded4c18879a5c1f893db4fa3038f0cced428de260174cb9154aa8ec",
  "signature": {
    "algorithm": "Ed25519",
    "keyId": "shine-bible-content-2026-01",
    "signedObject": "payload",
    "value": "Al98mSrrsZYEpgBuIC2y48lBDWZQy4FUaE_vimLVA5JtkAPj3USPV21d8_TUcdFh3mHFmbhzLPXpmrhm6aViBw"
  }
}
